{
  "$schema": "http://json-schema.org/draft-07/schema#",
  "$id": "https://xmiete.org/schemas/xmiete_schema.json",
  "$comment": "Licensed under Creative Commons Attribution 4.0 International (CC BY 4.0). See LICENSE-SPECIFICATION for details.",
  "title": "XMiete Core Schema",
  "description": "A modular standard for digital rental deposits (BGB § 551 compliant).",
  "type": "object",
  "required": [
    "meta",
    "tenant",
    "landlord",
    "property",
    "deposit"
  ],
  "properties": {
    "meta": {
      "type": "object",
      "required": ["version", "timestamp"],
      "properties": {
        "version": { "type": "string", "example": "1.0.0" },
        "timestamp": { "type": "string", "format": "date-time" },
        "external_id": { "type": "string", "description": "ID from the calling system" }
      }
    },
    "tenant": {
      "type": "object",
      "required": ["first_name", "last_name", "email"],
      "properties": {
        "first_name": { "type": "string" },
        "last_name": { "type": "string" },
        "email": { "type": "string", "format": "email" },
        "tax_id": { 
          "type": "string", 
          "pattern": "^[0-9]{11}$",
          "description": "German 11-digit Steuer-ID for tax logic."
        },
        "eid_status": {
          "type": "string",
          "enum": ["NOT_STARTED", "IN_PROGRESS", "VERIFIED", "FAILED"],
          "default": "NOT_STARTED"
        },
        "wallet_metadata": { "$ref": "#/definitions/wallet_metadata" },
        "address": { "$ref": "#/definitions/address" }
      }
    },
    "landlord": {
      "type": "object",
      "required": ["name"],
      "properties": {
        "name": { "type": "string", "description": "Name of landlord or property management" },
        "type": { "type": "string", "enum": ["PRIVATE", "COMMERCIAL"] },
        "iban": { "type": "string", "pattern": "^[A-Z]{2}[0-9]{2}[A-Z0-9]{11,30}$" }
      }
    },
    "property": {
      "type": "object",
      "required": ["address"],
      "properties": {
        "address": { "$ref": "#/definitions/address" },
        "unit_id": { "type": "string", "description": "Specific apartment/unit identifier" }
      }
    },
    "deposit": {
      "type": "object",
      "required": ["amount", "currency", "type", "lifecycle_state"],
      "properties": {
        "amount": { "type": "number", "minimum": 0 },
        "currency": { "type": "string", "pattern": "^[A-Z]{3}$", "default": "EUR" },
        "type": { 
          "type": "string", 
          "enum": ["CASH_EQUIVALENT", "BANK_GUARANTEE", "INSURANCE"] 
        },
        "lifecycle_state": {
          "type": "string",
          "enum": ["REQUESTED", "IDENTIFIED", "FUNDED", "PLEDGED", "RELEASED", "CLAIMED", "CLOSED"]
        },
        "history": {
          "type": "array",
          "items": {
            "type": "object",
            "required": ["state", "timestamp"],
            "properties": {
              "state": { 
                "type": "string",
                "enum": ["REQUESTED", "IDENTIFIED", "FUNDED", "PLEDGED", "RELEASED", "CLAIMED", "CLOSED"]
              },
              "timestamp": { "type": "string", "format": "date-time" },
              "actor": { "type": "string", "description": "Entity that triggered the transition (e.g., TENANT, BANK, LANDLORD)" },
              "comment": { "type": "string" },
              "signature": { "type": "string", "description": "JWS (JSON Web Signature) for non-repudiation of critical transitions." }
            }
          }
        }
      }
    },
    "pledge": {
      "type": "object",
      "description": "BGB § 551 specific data",
      "properties": {
        "pledge_date": { "type": "string", "format": "date" },
        "legal_reference": { "type": "string", "default": "BGB § 551" },
        "is_confirmed_by_bank": { "type": "boolean", "default": false }
      }
    },
    "provider": {
      "type": "object",
      "description": "Information about the bank, insurer, or fintech platform providing the deposit.",
      "required": ["provider_type", "executing_entity"],
      "properties": {
        "provider_type": {
          "type": "string",
          "enum": ["BANK_SYSTEM_PARTNER", "INSURANCE_BROKER", "DIRECT_BANK", "FINTECH_PLATFORM"]
        },
        "executing_entity": {
          "type": "string",
          "description": "The legal entity holding the funds or issuing the guarantee (e.g., Aareal Bank, Volksbank, Instabank)."
        },
        "brand_name": {
          "type": "string",
          "description": "The brand or platform name facing the user (e.g., GetMomo, PlusForta, Smartmiete)."
        },
        "provider_id": { "type": "string", "description": "Internal identifier for the provider" },
        "insurance_policy_number": { "type": "string" },
        "custom_fields": { "type": "object" }
      }
    },
    "transport": {
      "type": "object",
      "description": "Transport protocol configuration for bank-system communication. Defaults to REST; set protocol to EBICS for banks that use EBICS infrastructure.",
      "required": ["protocol"],
      "properties": {
        "protocol": {
          "type": "string",
          "enum": ["REST", "EBICS"],
          "default": "REST",
          "description": "Transport protocol used to exchange XMiete messages with the bank system."
        },
        "ebics_metadata": { "$ref": "#/definitions/ebics_metadata" }
      },
      "if": {
        "properties": { "protocol": { "const": "EBICS" } },
        "required": ["protocol"]
      },
      "then": {
        "required": ["ebics_metadata"]
      }
    }
  },
  "definitions": {
    "wallet_metadata": {
      "type": "object",
      "description": "eIDAS 2.0 / EUDI-Wallet credential metadata for tenant identity verification.",
      "properties": {
        "issuer": {
          "type": "string",
          "description": "Human-readable name of the credential issuer (e.g., 'Bundesdruckerei GmbH')."
        },
        "issuer_id": {
          "type": "string",
          "description": "URI or DID identifying the credential issuer (e.g., 'https://pid.bundesdruckerei.de' or 'did:web:bundesdruckerei.de')."
        },
        "wallet_provider": {
          "type": "string",
          "description": "Identifier of the EUDI Wallet provider app (e.g., 'bundesdruckerei', 'lissi', 'sprind')."
        },
        "credential_type": {
          "type": "string",
          "enum": ["PID", "EAA", "QEAA", "MDL"],
          "description": "EUDI credential type: PID (Person Identification Data), EAA/QEAA (Electronic Attestation of Attributes), or MDL (mobile Driving License)."
        },
        "credential_format": {
          "type": "string",
          "enum": ["vc+sd-jwt", "mso_mdoc", "ldp_vc"],
          "description": "Credential encoding format per OpenID4VCI / EUDI ARF."
        },
        "assurance_level": {
          "type": "string",
          "enum": ["low", "substantial", "high"],
          "description": "eIDAS Level of Assurance per Article 8 of Regulation (EU) No 910/2014 as amended by eIDAS 2.0."
        },
        "presentation_id": {
          "type": "string",
          "description": "Opaque reference to the Verifiable Presentation submitted during verification."
        },
        "issuing_country": {
          "type": "string",
          "pattern": "^[A-Z]{2}$",
          "description": "ISO 3166-1 alpha-2 country code of the credential issuer."
        },
        "verified_at": {
          "type": "string",
          "format": "date-time",
          "description": "Timestamp when the EUDI Wallet presentation was verified by the relying party."
        },
        "expires_at": {
          "type": "string",
          "format": "date-time",
          "description": "Expiry timestamp of the wallet credential."
        }
      }
    },
    "address": {
      "type": "object",
      "required": ["street", "zip", "city", "country"],
      "properties": {
        "street": { "type": "string" },
        "zip": { "type": "string" },
        "city": { "type": "string" },
        "country": { "type": "string", "pattern": "^[A-Z]{2}$", "default": "DE" }
      }
    },
    "kautions_pfand_nachweis": {
      "type": "object",
      "description": "QEAA credential schema for KautionsPfandNachweis — issued by a bank into the tenant's EUDI Wallet after deposit pledge. Format: SD-JWT (vc+sd-jwt). Governed by OpenID4VCI Pre-Authorized Code Flow.",
      "required": ["deposit_id", "pledge_date", "legal_reference", "issuing_bank"],
      "properties": {
        "deposit_id": {
          "type": "string",
          "description": "XMiete deposit identifier that this credential attests."
        },
        "deposit_amount": {
          "type": "number",
          "minimum": 0,
          "description": "[Selectively Disclosed] Amount of the pledged deposit in euros."
        },
        "currency": {
          "type": "string",
          "pattern": "^[A-Z]{3}$",
          "default": "EUR",
          "description": "[Selectively Disclosed] ISO 4217 currency code."
        },
        "pledge_date": {
          "type": "string",
          "format": "date",
          "description": "ISO 8601 date on which the deposit was legally pledged."
        },
        "pledged_until": {
          "type": "string",
          "format": "date",
          "description": "[Selectively Disclosed] ISO 8601 date until which the pledge is in effect (typically end of tenancy)."
        },
        "legal_reference": {
          "type": "string",
          "default": "BGB § 551",
          "description": "Legal basis for the pledge (always revealed)."
        },
        "issuing_bank": {
          "type": "string",
          "description": "Full legal name of the bank issuing the credential (e.g., 'Aareal Bank AG')."
        },
        "issuing_bank_id": {
          "type": "string",
          "description": "URI or DID identifying the issuing bank (e.g., 'https://aareal.bank' or 'did:web:aareal.bank')."
        },
        "property_id": {
          "type": "string",
          "description": "Optional opaque property or unit identifier from the landlord's system."
        },
        "property_address": {
          "type": "string",
          "description": "[Selectively Disclosed] Human-readable address of the rental property."
        },
        "tenant_first_name": {
          "type": "string",
          "description": "[Selectively Disclosed] First name of the tenant."
        },
        "tenant_last_name": {
          "type": "string",
          "description": "[Selectively Disclosed] Last name of the tenant."
        },
        "credential_id": {
          "type": "string",
          "pattern": "^urn:xmiete:credential:[0-9a-f-]{36}$",
          "description": "Globally unique credential identifier (maps to JWT 'jti' claim)."
        },
        "credential_format": {
          "type": "string",
          "const": "vc+sd-jwt",
          "description": "Credential encoding format — always vc+sd-jwt for KautionsPfandNachweis."
        },
        "assurance_level": {
          "type": "string",
          "const": "high",
          "description": "eIDAS Level of Assurance — always 'high' for QEAA."
        },
        "issuance_flow": {
          "type": "string",
          "const": "OpenID4VCI Pre-Authorized Code Flow",
          "description": "OID4VCI grant type used for issuance."
        },
        "status_uri": {
          "type": "string",
          "format": "uri",
          "description": "URL at which verifiers can check the current status (active/revoked) of this credential."
        }
      }
    },
    "ebics_btf": {
      "type": "object",
      "description": "EBICS 3.0 Business Transaction Format (BTF) — replaces order types from EBICS 2.x.",
      "required": ["service_name", "msg_name"],
      "properties": {
        "service_name": {
          "type": "string",
          "description": "BTF service name (e.g., 'MCT' for SEPA Credit Transfer, 'STM' for statement/camt)."
        },
        "service_option": {
          "type": "string",
          "description": "Optional BTF service option qualifier (bank-specific)."
        },
        "scope": {
          "type": "string",
          "description": "BTF scope / country or region code (e.g., 'DE', 'EU')."
        },
        "container": {
          "type": "string",
          "enum": ["XML", "ZIP", "ZIP.b64"],
          "description": "BTF container format."
        },
        "msg_name": {
          "type": "string",
          "description": "ISO 20022 message name (e.g., 'pain.001', 'camt.054')."
        },
        "msg_version": {
          "type": "string",
          "description": "ISO 20022 message version suffix (e.g., '03', '08')."
        }
      }
    },
    "ebics_metadata": {
      "type": "object",
      "description": "EBICS connection parameters. Required when transport.protocol is EBICS.",
      "required": ["host_id", "partner_id", "user_id", "ebics_version", "bank_url"],
      "properties": {
        "host_id": {
          "type": "string",
          "description": "EBICS Host ID configured at the bank (e.g., 'AAREAL01')."
        },
        "partner_id": {
          "type": "string",
          "description": "EBICS Partner ID (Kundennummer assigned by the bank to the XMiete system operator)."
        },
        "user_id": {
          "type": "string",
          "description": "EBICS User ID (technical user for the XMiete system)."
        },
        "ebics_version": {
          "type": "string",
          "enum": ["2.4", "2.5", "3.0"],
          "description": "EBICS protocol version. Use 3.0 for BTF-based order routing; 2.4/2.5 for legacy order types."
        },
        "bank_url": {
          "type": "string",
          "format": "uri",
          "description": "HTTPS URL of the bank's EBICS server endpoint."
        },
        "order_type": {
          "type": "string",
          "description": "EBICS 2.x three-letter order type (e.g., 'CCT' for SEPA Credit Transfer, 'C54' for camt.054). Not used with EBICS 3.0; use btf instead."
        },
        "btf": {
          "$ref": "#/definitions/ebics_btf"
        },
        "signature_class": {
          "type": "string",
          "enum": ["T", "E", "A"],
          "description": "EBICS signature class: T (transport only), E (electronic/single), A (authorization/collective)."
        },
        "bank_bic": {
          "type": "string",
          "pattern": "^[A-Z]{4}[A-Z]{2}[A-Z0-9]{2}([A-Z0-9]{3})?$",
          "description": "BIC of the bank (ISO 9362)."
        }
      }
    },
    "issuance_session": {
      "type": "object",
      "description": "Tracks the state of an active OID4VCI issuance session for a deposit.",
      "properties": {
        "session_id": { "type": "string" },
        "credential_offer_url": {
          "type": "string",
          "description": "openid-credential-offer:// deep-link / QR payload for the tenant's wallet."
        },
        "state": {
          "type": "string",
          "enum": ["PENDING", "CONSUMED", "REVOKED"],
          "description": "PENDING: offer issued, wallet has not yet fetched credential. CONSUMED: credential successfully issued. REVOKED: credential invalidated (deposit released/closed)."
        },
        "expires_at": { "type": "string", "format": "date-time" },
        "credential_id": {
          "type": "string",
          "description": "Set after credential is issued; maps to KautionsPfandNachweis.credential_id."
        }
      }
    }
  }
}
